Dataset name,Dataset description,Granularity,Source,Purpose of the data ,Data controller,DPIA inclusion,Data Processor Organisations,Collecting and Sharing Governance
Covid-19 Hospitalisation in England Surveillance System (CHESS) - record level,"Demographics, 25 pages of information ",Record level,Public Health England,This will just say why the data is useful,Public Health England,Yes,"Arden & GEM (NHSE), Palantir",COPI Regulations
COVID related death information,Death notifications,Record Level,Health & Care Providers,"For example, this will be in a dashboard to support decision making",NHS England,No,"Arden & GEM (NHSE), Palantir, NHS Improvement",COPI Regulations
"International data daily dump of cases (infected, recovered, fatalities)",ECDC data - number of cases and deaths by country,Aggregate,?,,?,N/A,Palantir,N/A
Covid sitrep,"31 questions, 1330 refresh",Aggregate,SDCS - NHSD,,NHS England,Yes,"Arden & GEM (NHSE), Palantir, NHS Improvement",Aggregate Collection
PHE Lab Test Data - Record Level,Positive test results from PHE SGSS (Second Generation Surveillance System). Anonymised,Record level,Public Health England,,Public Health England,Yes,"Arden & GEM (NHSE), Palantir, NHS Improvement",Aggregate collection
PHE Lab Test Data - Aggregate,Positive test results from PHE SGSS (Second Generation Surveillance System). Anonymised,Aggregate,Public Health England,,Public Health England,Yes,"Arden & GEM (NHSE), Palantir, NHS Improvement",COPI Regulations
A&E sitrep,Number of beds open and occupied. Critical care open and occupied A&E attendances etc.,Aggregate,NHSI,,NHS Improvement,Yes,"Arden & GEM (NHSE), Palantir, NHS Improvement",Aggregate collection
Master Patient Index (MPI) - frailty flag,"De-identified demographics with SOA, LSOA and flags such as frailty which provide healthcare markers. Lists of all patients, demographics, geographics. Contains large amounts of PHI, including post code. Flags for frailty and care home. Fed in by NHAIS (National Health Application and Infrastructure Services)",Record level,NHS Digital,,NHS England,Yes,"Arden & GEM (NHSE), Palantir",Data controller
Care home beds,"Capacity information for beds availabiloty in care homes - received via LogicApp. Beds by type, staff total.",Aggregate,Health & Care Providers,,NHS England,No,Arden & GEM (NHSE),Aggregate collection
Aggregated 111 call (NHS Improvement),"Number of daily triaged calls per CCG & among triaged calls number of A&E, ambulance and primary care calls. 15 minutes. Disposal of call. Not specifically COVID.",Aggregate,NHS Digital SDCS-SeFT,,NHS Improvement,Yes,"Arden & GEM (NHSE), Palantir",Aggregate collection
SUS+ ECDS,Contains all record level data items Understand how and why people attend Accident and Emergency (A&E) Departments with clinical informaiton. Contains 108 data items better understand how and why people attend Accident and Emergency (A&E) Departments. Continuous daily feed - 11am land for 3 days previous,Record level,NHS Digital,,NHS England,Yes,"Arden & GEM (NHSE), Palantir",Existing DARS and joint data controller with NHS Digital
Record level 111 data (NHSI),"Information regarding each 111 call (connect timestamp, triage timestamp, clinical advisor transfer timestamp, is ambulance called, symptom group, disposition, etc).  Monthly with one month lag - feed from providers so not possible to get more recent cuts",Record level,NCDR,,NHS England,Yes,"Arden & GEM (NHSE), Palantir",Existing governance
111 telephony service activity records,Daily (from 10 March),Aggregate,NHS Digital,,NHS England,No,"Arden & GEM (NHSE), Palantir",
999 telephony activity records,Daily  (from 10 March),Record level,NHS Digital,,NHS England,,Arden & GEM (NHSE),
Segmentation,Record level registry for people with frailty and diabetes. 8 core groups plus 30 sub-segments,Record level,NHS England,,NHS England,Yes,"Arden & GEM (NHSE), Palantir",Existing Governance
ESR sickness,"A cut from ESR showing all active absences on the current day across all trusts, i.e. does not have absence end date so cannot see absence length or who is coming back to work etc.",Record level,ESR,Understand staff sickness levels and impact on Covid19 response. ,NHS Improvement,No,"Arden & GEM (NHSE), Palantir",TBD
Ventilator Orders,"From each supplier, country, price how many delivered each week",,,,NHS England,,"Arden & GEM (NHSE), Palantir",
Oxygen gas supply and capacity,"By trust and hospital - what is the oxygen supply, delivery capacity, gas pipeline system and ventilation system capacity",Aggregate,,,NHS England,,"Arden & GEM (NHSE), Palantir",
SUS+ Outpatient (OPA),"Attendances into outpatient clinics with data held at record level. Mainly forms part of elective clinics. Part of the acute dataset. Can be daily, but not currently pulled daily as it is too large
",Record level,NHS Digital,,NHS England,Yes,Arden & GEM (NHSE),Existing DARS and joint data controller with NHS Digital
UKHF,"UK Health Facts database - aggregated 1k of datasets.
Focus on cancelled operations. Incomplete pathways",Aggregate,UKHF/D,,NHS England,,"Arden & GEM (NHSE), Palantir",Aggregate collection
ESR workforce,"Electronic staff record.
Number of hospital staff employed by trust, including specialty.
Count of ambulance staff. 
Use as a benchmarking piece. 
Staff by staff group, working in emergency care and intensive care. Can also be split by training (ventilator training?)",Aggregate,NHS ESR (BSA?),,NHS Improvement,Yes,"Arden & GEM (NHSE), Palantir",Existing Governance
SUS+ Inpatient (Admitted Patient Care Episodes - APCE - and Admitted Patient Care Spells - APCS),SUS,Record level,NHS Digital,,NHS England,Yes,"Arden & GEM (NHSE), Palantir",Existing DARS and joint data controller with NHS Digital
ICNARC,"Intensive care national audit and research centre. What support is being given to a patient and clinical information about that patient. Reporting completed; 
(i) after COVID case enters a unit
(ii) after 24 hours
(iii) after patient leaves critical care
(iv) after patient discharge",Record level,ICNARC network,,NHS England,No,"Arden & GEM (NHSE), Palantir",COPI Regulations
111 online screening data,No NHS number or linkable information,Record level,NHS Digital 111,,NHS England,No,"Arden & GEM (NHSE), Palantir",No identifiers and COPI regs would cover
Splunk 111 - Vodafone,Raw 111 call data (1 day lag). Not linkable to other record level sources. By area code.,Record level,NHS Digital,,NHS England,,"Arden & GEM (NHSE), Palantir",Existing Governance
Shielded Patient List,,,,,,,,
PHE negative test results,Negative test results from PHE SGSS (Second Generation Surveillance System). Anonymised,Record level,Public Health England,,Public Health England,,"Arden & GEM (NHSE), Palantir",
COVID Critical Care data,From DOS (Directory of Services). More detail provided in the adult critical care bed state definitions document,,,,,,,
Testing PPE inventory,"Testing PPE inventory, burn rates, and demand forecasts, sourced from Shirley Zhang (Deloitte).

The data included is: the inventory of PPE stock in each testing location, it showed the burn rate of PPE at each location, forecast demand, opening and closing stock projections for each day. This was then pulled into dashboards.",Aggregate,Deloitte,,,,,
Historical testing sites SITREPs,"This data includes historical sitrep response data from testing sites - their PPE inventory, testing kit inventory, and personnel. We need this to form a complete picture of testing site demand. 

Inventory of testing items, number of personnel on site, PPE and consumable inventory.
",Aggregate,,,,,,
Testing Site Predicted Capacity,"Testing site Predicted Capability from James.kelly@deloitte.co.uk 

We are working towards a V0 for Alex Cooper and No.10 by Saturday afternoon.

Data to be included:

cols: site name, date 1, date 2, date 3, date 4
rows: sitex, capacity at date1, capacity at date 2, capacity at date 3 etc.
",Aggregate,,,,,,
Testing Site Predicted Demand,"Testing site Demand from kat.benjamin@deloitte.co.uk 

This is for development and creation for Saturday afternoon for Alex Cooper at No. 10.
Data to be included:

cols: site name, date 1, date 2, date 3, date 4
rows: sitex, demand at date1, demand at date 2, demand at date 3 etc.
",Aggregate,,,,,,
NPEX testing,,,,,,,,
COVID ISP SITREP,Replicated the COVID SITREP but for independent service providers,Aggregate,SDCS - NHSD,,NHS Improvement,,"Arden & GEM (NHSE), Palantir, NHS Improvement",
NHS Region Code Mappings,,N/A,,,,,,
"Workforce - Social Care, The Adult Social Care Workforce Data Set",,Aggregate,,,,,,
Supply Chain - China Freight,,,,,,,,
Scotland Cases/ Tests,,,,,,,,
ESR Data for sickness model,,,,,,,,
Covid-19 Hospitalisation in England Surveillance System (CHESS) - aggregate,1-Time load only. CHESS. Demographics. 25 pages of information. It's a legal obligation that the patient has to complete this.,Aggregate,Public Health England,,PHE,,"Arden & GEM (NHSE), Palantir",
COVID related death information - aggregate,Death notifications: COVIDrelateddeaths container. Formed of live deaths dashboard and daily deaths extract going into dashboard,Aggregate,AGEM,,,,,
SUS+ critical care,Part of the SUS data - shows patients in CC,,NHS Digital,,,,,
Temp Workers - Agency Collection Bank Over Threshold,Agency information from NHS Trusts,Aggregate,NHSI,,NHS Improvement,,"Arden & GEM (NHSE), Palantir, NHS Improvement",
Temp Workers -Agency Collection Highest Paid Workers,Agency information from NHS Trusts,Aggregate,NHSI,,NHS Improvement,,"Arden & GEM (NHSE), Palantir, NHS Improvement",
Temp Workers - Agency Spend Bank Usage Weekly,Agency information from NHS Trusts,Aggregate,NHSI,,NHS Improvement,,"Arden & GEM (NHSE), Palantir, NHS Improvement",
Temp Workers - Agency Spend Override Weekly,Agency information from NHS Trusts,Aggregate,NHSI,,NHS Improvement,,"Arden & GEM (NHSE), Palantir, NHS Improvement",
Temp Workers - Temp Staffing Activity Finance,Agency information from NHS Trusts,Aggregate,NHSI,,NHS Improvement,,"Arden & GEM (NHSE), Palantir, NHS Improvement",
Staff sickness (allocate),"Taken from allocate system which is used for rotas in ~90% of trusts. Should cover all people who do shift work accurately, but may be lacking for office workers",Record level,,,,,,
111 Real-time,"15 mins feed to fetch the CallAE, CallAmb, CallTriage and CallPC",Aggregate,NHSD,,NHS Improvement,,"Arden & GEM (NHSE), Palantir, NHS Improvement",
UKHD,"Contains all reference data to be able to understand the other DS. Includes codes as well as other reference material such as demographics, population etc.",N/A,,,,,,
Status Checker (aka Research Survey),Self reported status of one's wellbeing and symptoms and location.,Aggregate,NHS Digital,Understand trend and volumen of symptom reporting. ,NHSD,TBD,"Arden & GEM (NHSE), Palantir",TBD
Gov.uk - Covid-19 Page Statistics,Testing usefulness of page visits related to Covid-19,Aggregate,Gov.uk,Understand general ,gov.uk,TBD,"Arden & GEM (NHSE), Palantir",TBD
111 SMS,,,,,,,,
Intermediate SUS tables AE,Processed table created for inernal analysis purposes. ,Record level,NHSE/I ,AE activity levels to understand impact on Covid19 response. ,NHSEI,TBD,TBD,TBD
Vulnerable persons,Shielded Patient List. Circa 1.5 million vulnerable people,Record level,AGEM,,NHSD,,"Arden & GEM (NHSE), Palantir",
MONTHLY 111,I'm wondering whether this is the equivalnet of the Record level 111 data from NCDR. That is produced monthly.,,AGEM,,,,,
MH and LD sitrep,,,,,,,,
NHS 111 MDS daily from DB,,Aggregate,NHS Digital,Understand 111 activity volumes and patternes to understand impact on Covid19 response. ,NHSD,TBD,TBD,TBD